{
  "id": "example/research",
  "kind": "knowledge-method",
  "version": "0.1.0",
  "manifest": {
    "locator": "https://example.com/research/method.yaml",
    "revision": "example-revision-001",
    "digest": "sha256:3333333333333333333333333333333333333333333333333333333333333333"
  },
  "approval_reference": "example-approval"
}
